<?xml version="1.0" encoding="UTF-8"?>
<template xmlns="http://thelia.net/schema/dic/template"
        xmlns:xsi="http://www.w3.org/2001/XMLSchema-instance"
        xsi:schemaLocation="http://thelia.net/schema/dic/template http://thelia.net/schema/dic/template/template-1_0.xsd">
    <descriptive locale="fr">
        <title>Template back-office Thelia 3 (Twig)</title>
    </descriptive>
    <descriptive locale="en">
        <title>Thelia 3 back-office template (Twig)</title>
    </descriptive>
    <languages>
        <language>en_US</language>
        <language>fr_FR</language>
    </languages>
    <version>1.0.0</version>
    <authors>
        <author>
            <name>Thelia team</name>
            <company>thelia.net</company>
            <email>contact@thelia.net</email>
            <website>thelia.net</website>
        </author>
    </authors>
    <thelia>2.5.4</thelia>
    <stability>alpha</stability>
    <assets>dist</assets>
</template>
